{
  "$schema": "https://json-schema.org/draft/2020-12/schema",
  "$id": "https://woodshop.dev/schemas/extract_cutlist.output.json",
  "title": "ExtractCutlistOutput",
  "type": "object",
  "additionalProperties": false,
  "properties": {
    "project_id": { "$ref": "./common.schema.json#/$defs/projectId" },
    "rows": {
      "type": "array",
      "items": { "$ref": "./common.schema.json#/$defs/cutlistRow" }
    },
    "totals": {
      "type": "object",
      "additionalProperties": false,
      "properties": {
        "parts": { "type": "integer", "minimum": 0 },
        "material_totals": {
          "type": "array",
          "items": { "$ref": "./common.schema.json#/$defs/materialTotalsItem" }
        }
      },
      "required": ["parts", "material_totals"]
    },
    "seed": { "$ref": "./common.schema.json#/$defs/seedOutput" },
    "engine_versions": { "$ref": "./common.schema.json#/$defs/engineVersions" },
    "revision_id": { "$ref": "./common.schema.json#/$defs/revisionId" },
    "inputs_hash": { "$ref": "./common.schema.json#/$defs/inputsHash" }
  },
  "required": [
    "project_id",
    "rows",
    "totals",
    "seed",
    "engine_versions",
    "revision_id",
    "inputs_hash"
  ]
}
