{
  "engine_versions": {
    "cam": "0.0.0",
    "nest": "0.0.0",
    "occt": "0.0.0",
    "schemas": "0.0.0",
    "wood": "0.0.0"
  },
  "inputs_hash": "e04bd9ca485ab822cb0275dcd3154b87418a6c78ec65a234c33f5022367fa6bd",
  "project_id": "proj_d58c3867f507",
  "revision_id": "97fd46038317a780454e2e7dcb5ce0255739c36b",
  "rows": [
    {
      "grain": "width",
      "length_mm": 1200,
      "material": "Backer Ply 6mm",
      "name": "Back Panel",
      "part_id": "proj_d58c3867f507::back_panel",
      "quantity": 1,
      "thickness_mm": 6,
      "width_mm": 762
    },
    {
      "grain": "width",
      "length_mm": 1200,
      "material": "Birch Ply 18mm",
      "name": "Bottom",
      "part_id": "proj_d58c3867f507::panel_bottom",
      "quantity": 1,
      "thickness_mm": 18,
      "width_mm": 400
    },
    {
      "grain": "length",
      "length_mm": 762,
      "material": "Birch Ply 18mm",
      "name": "Side A",
      "part_id": "proj_d58c3867f507::panel_side_a",
      "quantity": 2,
      "thickness_mm": 18,
      "width_mm": 381
    },
    {
      "grain": "length",
      "length_mm": 762,
      "material": "Birch Ply 18mm",
      "name": "Side B",
      "part_id": "proj_d58c3867f507::panel_side_b",
      "quantity": 2,
      "thickness_mm": 18,
      "width_mm": 381
    },
    {
      "grain": "width",
      "length_mm": 1200,
      "material": "Birch Ply 18mm",
      "name": "Top",
      "part_id": "proj_d58c3867f507::panel_top",
      "quantity": 1,
      "thickness_mm": 18,
      "width_mm": 400
    },
    {
      "grain": "width",
      "length_mm": 1150,
      "material": "Birch Ply 18mm",
      "name": "Middle Shelf",
      "part_id": "proj_d58c3867f507::shelf_mid",
      "quantity": 1,
      "thickness_mm": 18,
      "width_mm": 380
    }
  ],
  "seed": 5,
  "totals": {
    "material_totals": [
      {
        "count": 1,
        "material": "Backer Ply 6mm"
      },
      {
        "count": 7,
        "material": "Birch Ply 18mm"
      }
    ],
    "parts": 8
  }
}
